{
  "schema_version": "2.3",
  "assertion_id": "efa_01J00000000000000000000011",
  "project_id": "efp_01J00000000000000000000001",
  "tree_revision_id": "eft_01J00000000000000000000005",
  "workflow_occurrence_id": "efw_01J00000000000000000000014",
  "issuer": {
    "kind": "model",
    "name": "role-assertor",
    "version": "profile-2.2",
    "model": "configured-model"
  },
  "assertion_type": "role_proposal",
  "created_at": "2026-07-15T12:11:00Z",
  "subject_refs": [
    "path:authorities/system-design/spec.md"
  ],
  "input_refs": [
    "tree:eft_01J00000000000000000000005",
    "source:efs_01J00000000000000000000008@1"
  ],
  "claims": [
    {
      "predicate": "workflow_role",
      "value": "semantic_authority",
      "confidence": 0.94,
      "explanation": "The accepted source history and path scope identify the file as controlling design content."
    }
  ],
  "limitations": [
    "The assertion does not establish platform artifact metadata."
  ],
  "content_digest": "sha256:dddddddddddddddddddddddddddddddddddddddddddddddddddddddddddddddd"
}
